{
  "schema_version": 2,
  "agent_name": "claude_desktop_agent",
  "title": "Claude Desktop",
  "description": "User-calibrated local desktop controls for an installed Claude app.",
  "app_id": "claude_desktop",
  "transport": "desktop_gui",
  "process_names": {
    "windows": ["Claude.exe"],
    "macos": ["Claude"],
    "linux": ["claude", "claude-desktop"]
  },
  "window_title_hints": {
    "windows": ["Claude"],
    "macos": ["Claude"],
    "linux": ["Claude"]
  },
  "launch_commands": {},
  "working_directory_strategy": {},
  "preferred_prompt_target_id": "composer_box",
  "preferred_submit_target_id": "send_button",
  "preferred_copy_response_target_id": "copy_response_button",
  "asset_packs": [],
  "tags": ["desktop-control", "user-local-calibration"]
}
