{
  "schema_version": 2,
  "agent_name": "antigravity_agent",
  "title": "Antigravity",
  "description": "User-calibrated local desktop controls for an installed Antigravity app.",
  "app_id": "antigravity_desktop",
  "transport": "desktop_gui",
  "process_names": {
    "windows": ["Antigravity.exe", "Antigravity", "agy.exe"],
    "macos": ["Antigravity", "agy"],
    "linux": ["antigravity", "agy"]
  },
  "window_title_hints": {
    "windows": ["Antigravity", "AutoYou"],
    "macos": ["Antigravity"],
    "linux": ["Antigravity"]
  },
  "launch_commands": {},
  "working_directory_strategy": {},
  "preferred_prompt_target_id": "composer_box",
  "preferred_submit_target_id": "send_button",
  "preferred_copy_response_target_id": "copy_response_button",
  "asset_packs": [],
  "tags": ["desktop-control", "user-local-calibration"]
}
